{
  "id": "kmplayer-vs-vlc-media-player-4",
  "proprietaryId": "kmplayer",
  "openSourceId": "vlc-media-player-4",
  "featureComparison": [
    {
      "feature": "核心功能",
      "proprietarySupport": "yes",
      "openSourceSupport": "yes"
    },
    {
      "feature": "高级功能",
      "proprietarySupport": "yes",
      "openSourceSupport": "partial",
      "notes": "VLC media player 在高级功能上弱于 KMPlayer"
    },
    {
      "feature": "跨平台支持",
      "proprietarySupport": "yes",
      "openSourceSupport": "yes"
    }
  ],
  "pros": [
    "VLC media player 完全开源免费",
    "VLC media player 跨平台支持",
    "无订阅费用",
    "社区活跃"
  ],
  "cons": [
    "VLC media player 学习曲线较陡",
    "部分高级功能缺失",
    "企业级支持有限"
  ],
  "migrationDifficulty": "medium",
  "useCases": [
    "个人用户",
    "教育用途",
    "预算有限的团队",
    "开源爱好者"
  ],
  "aiGenerated": true,
  "aiGeneratedDetails": {
    "model": "agnes-2.0-flash-mock",
    "generatedAt": "2026-07-19T02:19:40+00:00",
    "promptHash": "sha256:52e1bc501a57c489cf44d7ba4cb8530cf0ddd79335fc53241acb77e3828d12fd",
    "tokensUsed": 200
  },
  "reviewStatus": "pending",
  "metadata": {
    "created": "2026-07-19",
    "updated": "2026-07-19",
    "rawResponseLength": 0
  },
  "_meta": {
    "source": "ai-generated-mock",
    "schema_version": "1.0.0",
    "unverified_fields": [
      "pros",
      "cons",
      "featureComparison"
    ],
    "confidence": "medium"
  }
}