{
  "id": "eset-endpoint-vs-clamav-business-2",
  "proprietaryId": "eset-endpoint",
  "openSourceId": "clamav-business-2",
  "featureComparison": [
    {
      "feature": "核心功能",
      "proprietarySupport": "yes",
      "openSourceSupport": "yes"
    },
    {
      "feature": "高级功能",
      "proprietarySupport": "yes",
      "openSourceSupport": "partial",
      "notes": "ClamAV for Business 在高级功能上弱于 ESET Endpoint Security"
    },
    {
      "feature": "跨平台支持",
      "proprietarySupport": "yes",
      "openSourceSupport": "yes"
    }
  ],
  "pros": [
    "ClamAV for Business 完全开源免费",
    "ClamAV for Business 跨平台支持",
    "无订阅费用",
    "社区活跃"
  ],
  "cons": [
    "ClamAV for Business 学习曲线较陡",
    "部分高级功能缺失",
    "企业级支持有限"
  ],
  "migrationDifficulty": "medium",
  "useCases": [
    "个人用户",
    "教育用途",
    "预算有限的团队",
    "开源爱好者"
  ],
  "aiGenerated": true,
  "aiGeneratedDetails": {
    "model": "agnes-2.0-flash-mock",
    "generatedAt": "2026-07-19T02:19:40+00:00",
    "promptHash": "sha256:5a64742f655143298d561193afa5336ff816ec42f6527579c6bd6d1a2be7c6d4",
    "tokensUsed": 200
  },
  "reviewStatus": "pending",
  "metadata": {
    "created": "2026-07-19",
    "updated": "2026-07-19",
    "rawResponseLength": 0
  },
  "_meta": {
    "source": "ai-generated-mock",
    "schema_version": "1.0.0",
    "unverified_fields": [
      "pros",
      "cons",
      "featureComparison"
    ],
    "confidence": "medium"
  }
}